{
  "id": 20,
  "title": "Precision",
  "description": "Precision 1 + 7 ( + 3 )",
  "readonly": true,
  "series": [
    {
      "name": "Provserie",
      "optional": false,
      "events": [
        {
          "duration": 5000,
          "audio_ids": [
            50
          ]
        },
        {
          "duration": 57000,
          "audio_ids": [
            26
          ]
        },
        {
          "duration": 3000,
          "audio_ids": [
            31
          ]
        },
        {
          "duration": 297000,
          "audio_ids": [
            33
          ]
        },
        {
          "duration": 3000,
          "audio_ids": [
            35
          ]
        },
        {
          "duration": 1000,
          "audio_ids": [
            37,
            36,
            39
          ]
        }
      ]
    },
    {
      "name": "Serie 1 5min",
      "optional": false,
      "events": [
        {
          "duration": 5000,
          "audio_ids": [
            1
          ]
        },
        {
          "duration": 57000,
          "audio_ids": [
            26
          ]
        },
        {
          "duration": 3000,
          "audio_ids": [
            31
          ]
        },
        {
          "duration": 297000,
          "audio_ids": [
            33
          ]
        },
        {
          "duration": 3000,
          "audio_ids": [
            35
          ]
        },
        {
          "duration": 1000,
          "audio_ids": [
            37,
            36,
            39
          ]
        }
      ]
    },
    {
      "name": "Serie 2 5min",
      "optional": false,
      "events": [
        {
          "duration": 5000,
          "audio_ids": [
            1
          ]
        },
        {
          "duration": 57000,
          "audio_ids": [
            26
          ]
        },
        {
          "duration": 3000,
          "audio_ids": [
            31
          ]
        },
        {
          "duration": 297000,
          "audio_ids": [
            33
          ]
        },
        {
          "duration": 3000,
          "audio_ids": [
            35
          ]
        },
        {
          "duration": 1000,
          "audio_ids": [
            37,
            36,
            39
          ]
        }
      ]
    },
    {
      "name": "Serie 3 5min",
      "optional": false,
      "events": [
        {
          "duration": 5000,
          "audio_ids": [
            1
          ]
        },
        {
          "duration": 57000,
          "audio_ids": [
            26
          ]
        },
        {
          "duration": 3000,
          "audio_ids": [
            31
          ]
        },
        {
          "duration": 297000,
          "audio_ids": [
            33
          ]
        },
        {
          "duration": 3000,
          "audio_ids": [
            35
          ]
        },
        {
          "duration": 1000,
          "audio_ids": [
            37,
            36,
            39
          ]
        }
      ]
    },
    {
      "name": "Serie 4 5min",
      "optional": false,
      "events": [
        {
          "duration": 5000,
          "audio_ids": [
            1
          ]
        },
        {
          "duration": 57000,
          "audio_ids": [
            26
          ]
        },
        {
          "duration": 3000,
          "audio_ids": [
            31
          ]
        },
        {
          "duration": 297000,
          "audio_ids": [
            33
          ]
        },
        {
          "duration": 3000,
          "audio_ids": [
            35
          ]
        },
        {
          "duration": 1000,
          "audio_ids": [
            37,
            36,
            39
          ]
        }
      ]
    },
    {
      "name": "Serie 5 5min",
      "optional": false,
      "events": [
        {
          "duration": 5000,
          "audio_ids": [
            1
          ]
        },
        {
          "duration": 57000,
          "audio_ids": [
            26
          ]
        },
        {
          "duration": 3000,
          "audio_ids": [
            31
          ]
        },
        {
          "duration": 297000,
          "audio_ids": [
            33
          ]
        },
        {
          "duration": 3000,
          "audio_ids": [
            35
          ]
        },
        {
          "duration": 1000,
          "audio_ids": [
            37,
            36,
            39
          ]
        }
      ]
    },
    {
      "name": "Serie 6 5min",
      "optional": false,
      "events": [
        {
          "duration": 5000,
          "audio_ids": [
            1
          ]
        },
        {
          "duration": 57000,
          "audio_ids": [
            26
          ]
        },
        {
          "duration": 3000,
          "audio_ids": [
            31
          ]
        },
        {
          "duration": 297000,
          "audio_ids": [
            33
          ]
        },
        {
          "duration": 3000,
          "audio_ids": [
            35
          ]
        },
        {
          "duration": 1000,
          "audio_ids": [
            37,
            36,
            39
          ]
        }
      ]
    },
    {
      "name": "Serie 7 5min",
      "optional": false,
      "events": [
        {
          "duration": 5000,
          "audio_ids": [
            1
          ]
        },
        {
          "duration": 57000,
          "audio_ids": [
            26
          ]
        },
        {
          "duration": 3000,
          "audio_ids": [
            31
          ]
        },
        {
          "duration": 297000,
          "audio_ids": [
            33
          ]
        },
        {
          "duration": 3000,
          "audio_ids": [
            35
          ]
        },
        {
          "duration": 1000,
          "audio_ids": [
            37,
            36,
            39
          ]
        }
      ]
    },
    {
      "name": "Serie 8 5min",
      "optional": true,
      "events": [
        {
          "duration": 5000,
          "audio_ids": [
            1
          ]
        },
        {
          "duration": 57000,
          "audio_ids": [
            26
          ]
        },
        {
          "duration": 3000,
          "audio_ids": [
            31
          ]
        },
        {
          "duration": 297000,
          "audio_ids": [
            33
          ]
        },
        {
          "duration": 3000,
          "audio_ids": [
            35
          ]
        },
        {
          "duration": 1000,
          "audio_ids": [
            37,
            36,
            39
          ]
        }
      ]
    },
    {
      "name": "Serie 9 5min",
      "optional": true,
      "events": [
        {
          "duration": 5000,
          "audio_ids": [
            1
          ]
        },
        {
          "duration": 57000,
          "audio_ids": [
            26
          ]
        },
        {
          "duration": 3000,
          "audio_ids": [
            31
          ]
        },
        {
          "duration": 297000,
          "audio_ids": [
            33
          ]
        },
        {
          "duration": 3000,
          "audio_ids": [
            35
          ]
        },
        {
          "duration": 1000,
          "audio_ids": [
            37,
            36,
            39
          ]
        }
      ]
    },
    {
      "name": "Serie 10 5min",
      "optional": true,
      "events": [
        {
          "duration": 5000,
          "audio_ids": [
            1
          ]
        },
        {
          "duration": 57000,
          "audio_ids": [
            26
          ]
        },
        {
          "duration": 3000,
          "audio_ids": [
            31
          ]
        },
        {
          "duration": 297000,
          "audio_ids": [
            33
          ]
        },
        {
          "duration": 3000,
          "audio_ids": [
            35
          ]
        },
        {
          "duration": 1000,
          "audio_ids": [
            37,
            36,
            39
          ]
        }
      ]
    }
  ]
}