{
    "id": 40,
    "title": "Fältträning",
    "description": "Each series starts hidden for 10s, then 3x show/hide cycles",
    "readonly": false,
    "series": [
        {
            "events": [
                {
                    "command": "hide",
                    "duration": 10000,
                    "audio_ids": [
                        1,
                        2
                    ]
                },
                {
                    "command": "show",
                    "duration": 3000
                },
                {
                    "command": "hide",
                    "duration": 3000
                },
                {
                    "command": "show",
                    "duration": 3000
                },
                {
                    "command": "hide",
                    "duration": 3000
                },
                {
                    "command": "show",
                    "duration": 3000
                },
                {
                    "command": "hide",
                    "duration": 3000
                }
            ],
            "name": "Series 1 (x=3, y=3)",
            "optional": false
        },
        {
            "events": [
                {
                    "command": "hide",
                    "duration": 10000
                },
                {
                    "command": "show",
                    "duration": 2000,
                    "audio_ids": [
                        1
                    ]
                },
                {
                    "command": "hide",
                    "duration": 3000
                },
                {
                    "command": "show",
                    "duration": 2000
                },
                {
                    "command": "hide",
                    "duration": 3000
                },
                {
                    "command": "show",
                    "duration": 2000
                },
                {
                    "command": "hide",
                    "duration": 3000
                }
            ],
            "name": "Series 2 (x=2, y=3)",
            "optional": false
        }
    ]
}